{
  "$schema": "../../static/schemas/merit-badge.schema.json",
  "title": "Painting",
  "slug": "painting",
  "url": "https://www.scouting.org/merit-badges/painting/",
  "eagle_required": false,
  "pamphlet_url": "https://filestore.scouting.org/filestore/Merit_Badge_ReqandRes/Pamphlets/Painting.pdf",
  "last_updated": "2026-01-10",
  "requirements": [
    {
      "req_id": "1",
      "path": "1",
      "text": "Explain the proper safety procedures to follow when preparing surfaces and applying coatings.",
      "resources": [
        {
          "title": "Interior Painting Safety (video)",
          "url": "https://www.youtube.com/watch?v=4vpr3e_erug"
        }
      ]
    },
    {
      "req_id": "2",
      "path": "2",
      "text": "Do the following:",
      "subrequirements": [
        {
          "req_id": "a",
          "path": "2.a",
          "text": "Explain three ways that coatings can improve a surface.",
          "resources": [
            {
              "title": "Epoxy Resin Coatings (video)",
              "url": "https://www.youtube.com/watch?v=A-ERekKoohI"
            }
          ]
        },
        {
          "req_id": "b",
          "path": "2.b",
          "text": "Explain the differences between oil-based paints, acrylic-based paints, and water-based paints.",
          "resources": [
            {
              "title": "Paints - Oil, Water, Enamel, Acrylic (video)",
              "url": "https://www.youtube.com/watch?v=jEyTpUfbrYA"
            },
            {
              "title": "Water vs Oil Based Paints (video)",
              "url": "https://www.youtube.com/watch?v=T99OFHCLF4s"
            }
          ]
        },
        {
          "req_id": "c",
          "path": "2.c",
          "text": "Explain where you would apply enamel paint, flat paint, wood stain, and varnish, and explain the importance of sheen.",
          "resources": [
            {
              "title": "Paint Sheen Differences Explained (video)",
              "url": "https://www.youtube.com/watch?v=DyKh80Yt9k0"
            }
          ]
        },
        {
          "req_id": "d",
          "path": "2.d",
          "text": "Tell why each is best for these uses."
        }
      ],
      "subrequirement_mode": {
        "type": "all"
      }
    },
    {
      "req_id": "3",
      "path": "3",
      "text": "Prepare and paint two different surfaces using patching materials or caulking and the proper primers and topcoats. Suggested projects include an interior or exterior wall, a door, a piece of furniture, a concrete wall or floor, a porch rail, or a fence. Your counselor must preapprove the projects.",
      "resources": [
        {
          "title": "How to Paint a Room (video)",
          "url": "https://www.youtube.com/watch?v=CRXCB_3gLok"
        }
      ]
    },
    {
      "req_id": "4",
      "path": "4",
      "text": "Prepare and paint an item using harmonizing colors that you have selected using the color wheel in the Painting merit badge pamphlet.",
      "resources": [
        {
          "title": "Choosing a Color Palette for Your Home (video)",
          "url": "https://www.youtube.com/watch?v=K75ynD7aAeg"
        },
        {
          "title": "Color Wheel from Painting Merit Badge Pamphlet (PDF)",
          "url": "https://filestore.scouting.org/filestore/Merit_Badge_ReqandRes/Requirement%20Resources/Painting/Painting_Color%20Wheet%20from%202025%20MBP.pdf"
        }
      ]
    },
    {
      "req_id": "5",
      "path": "5",
      "text": "Show the right way to use, clean, maintain, and store painting equipment.",
      "resources": [
        {
          "title": "Good Paint Hygiene (video)",
          "url": "https://www.youtube.com/watch?v=C_bY5_mOTcY"
        },
        {
          "title": "How to Clean and Store Paint Brushes (video)",
          "url": "https://www.youtube.com/watch?v=u6_e5YXgviY"
        }
      ]
    },
    {
      "req_id": "6",
      "path": "6",
      "text": "Explain the importance of ladder safety, personal hygiene, and the use of personal protective equipment when painting.",
      "resources": [
        {
          "title": "Ladder Safety (video)",
          "url": "https://www.youtube.com/watch?v=b7ArZilnnTE"
        },
        {
          "title": "Personal Protective Equipment for Painting (PPE) (video)",
          "url": "https://www.youtube.com/watch?v=67G06bhuxPA"
        }
      ]
    },
    {
      "req_id": "7",
      "path": "7",
      "text": "Explain some of the environmental and health issues concerning removing paint, applying paint, and discarding old paint.",
      "resources": [
        {
          "title": "How to Dispose of Old Paint (video)",
          "url": "https://www.youtube.com/watch?v=7YKuwlGgWpc"
        },
        {
          "title": "Paint Removers (video)",
          "url": "https://www.youtube.com/watch?v=8lG6dAZE52k"
        }
      ]
    },
    {
      "req_id": "8",
      "path": "8",
      "text": "Do ONE of the following:",
      "subrequirements": [
        {
          "req_id": "a",
          "path": "8.a",
          "text": "Explore careers related to this merit badge. Research one career to learn about the training and education needed, costs, job prospects, salary, job duties, and career advancement. Your research methods may include—with your parent or guardian's permission—an internet or library search, an interview with a professional in the field, or a visit to a location where people in this career work. Discuss with your counselor both your findings and what about this profession might make it an interesting career.",
          "resources": [
            {
              "title": "Painters Career Overview (video)",
              "url": "https://youtu.be/5glRwgnb5gk"
            },
            {
              "title": "Scenic Painter (video)",
              "url": "https://youtu.be/mWjbRoAId_4"
            }
          ]
        },
        {
          "req_id": "b",
          "path": "8.b",
          "text": "Explore how you could use knowledge and skills from this merit badge to pursue a hobby or healthy lifestyle. Research any training needed, expenses, and organizations that promote or support it. Discuss with your counselor what short-term and long-term goals you might have if you pursued this.",
          "resources": [
            {
              "title": "How to Paint Murals Like a Pro (video)",
              "url": "https://youtu.be/L4ADLL2gAtU"
            },
            {
              "title": "Easy Wall Painting DIY I Balcony Makeover I Yoga Wall Art (video)",
              "url": "https://youtu.be/UpImD3qedKw?si=CotiHOXpynF-JptZ"
            },
            {
              "title": "Mood-Boosting Paint Colors for Every Room in Your House (website)",
              "url": "https://www.marthastewart.com/8229238/mood-boosting-paint-colors"
            }
          ]
        }
      ],
      "subrequirement_mode": {
        "type": "select",
        "count": 1
      }
    }
  ]
}
