{
  "$schema": "../../static/schemas/merit-badge.schema.json",
  "title": "Woodwork",
  "slug": "woodwork",
  "url": "https://www.scouting.org/merit-badges/woodwork/",
  "eagle_required": false,
  "pamphlet_url": "https://filestore.scouting.org/filestore/Merit_Badge_ReqandRes/Pamphlets/Woodwork.pdf",
  "last_updated": "2026-02-26",
  "requirements": [
    {
      "req_id": "1",
      "path": "1",
      "text": "Do the following:",
      "subrequirements": [
        {
          "req_id": "a",
          "path": "1.a",
          "text": "Explain to your counselor the most likely hazards you may encounter while participating in woodwork activities, and what you should do to anticipate, help prevent, mitigate, and respond to these hazards. Explain what precautions you should take to safely use your tools.",
          "resources": [
            {
              "title": "Safety in Woodworking | Woodworking (video)",
              "url": "https://youtu.be/GQkUbdE3VS8?si=EpcwqUnpU9BDS6Cz"
            }
          ]
        },
        {
          "req_id": "b",
          "path": "1.b",
          "text": "Show that you know first aid for injuries that could occur while woodworking, including splinters, scratches, cuts, severe bleeding, and shock. Tell what precautions must be taken to help prevent loss of eyesight or hearing, and explain why and when it is necessary to use a dust mask.",
          "resources": [
            {
              "title": "The Emergency First Aid Kit for Woodworkers Need! (video)",
              "url": "https://youtu.be/A0EmfREhgRw?si=fh9F6uKkRvb4ogza"
            }
          ]
        },
        {
          "req_id": "c",
          "path": "1.c",
          "text": "Earn the Totin' Chip recognition."
        }
      ],
      "subrequirement_mode": {
        "type": "all"
      }
    },
    {
      "req_id": "2",
      "path": "2",
      "text": "Do the following:",
      "subrequirements": [
        {
          "req_id": "a",
          "path": "2.a",
          "text": "Describe how timber is grown, harvested, and milled. Tell how lumber is cured, seasoned, graded, and sized.",
          "resources": [
            {
              "title": "How Trees Are Made Into Lumber (video)",
              "url": "https://youtu.be/hOO37pcFg5I?si=K7r13Z-hpu-ZMAxB"
            }
          ]
        },
        {
          "req_id": "b",
          "path": "2.b",
          "text": "Collect and label blocks of six kinds of wood useful in woodworking. Describe the chief qualities of each. Give the best uses of each."
        }
      ],
      "subrequirement_mode": {
        "type": "all"
      }
    },
    {
      "req_id": "3",
      "path": "3",
      "text": "Do the following:",
      "subrequirements": [
        {
          "req_id": "a",
          "path": "3.a",
          "text": "Show the proper care, use, and storage of all working tools and equipment that you own or use at home or school.",
          "resources": [
            {
              "title": "Tool Maintenance 101: Tips for KeepingYour Woodworking Tools in Top Condition (website)",
              "url": "https://deltamachinery.com/tool-maintenance-101-tips-for-keepingyour-woodworking-tools-in-top-condition/"
            }
          ]
        },
        {
          "req_id": "b",
          "path": "3.b",
          "text": "Sharpen correctly the cutting edges of two different tools.",
          "resources": [
            {
              "title": "Best Method for Sharpening Your Chisels and Plane Irons (video)",
              "url": "https://youtu.be/2mJZH29bAHI?si=EdoNp283FRVbkTp_"
            }
          ]
        }
      ],
      "subrequirement_mode": {
        "type": "all"
      }
    },
    {
      "req_id": "4",
      "path": "4",
      "text": "Using a saw, plane, hammer, brace, and bit, make something useful of wood. Cut parts from lumber that you have squared and measured from working drawings.",
      "resources": [
        {
          "title": "Build This Simple Wooden Tool Box - Hand Saw And A Hammer (video)",
          "url": "https://youtu.be/xV6ql13lfjw?si=02XiV7e925ictjOt"
        },
        {
          "title": "How to Make a Bench Hook (video)",
          "url": "https://youtu.be/3WIjpz9Ut1c?si=ngE7zV5uIDXLN10w"
        }
      ]
    },
    {
      "req_id": "5",
      "path": "5",
      "text": "Create your own woodworking project. Begin by making working drawings, list the materials you will need to complete your project, and then build your project. Keep track of the time you spend and the cost of the materials."
    },
    {
      "req_id": "6",
      "path": "6",
      "text": "Do TWO of the following:",
      "subrequirements": [
        {
          "req_id": "a",
          "path": "6.a",
          "text": "Make working drawings of a project needing beveled or rounded edges and build it.",
          "resources": [
            {
              "title": "Bevels- How to Make Beveled Panels on the Tablesaw (video)",
              "url": "https://youtu.be/l06lCTcOgHQ?si=zFKD2q75qtORQzr"
            },
            {
              "title": "Rounded Edges- How to Rout Round Corners (video)",
              "url": "https://youtu.be/XztV4yjfFaI?si=8y6bA5TuRF-Tmoyv"
            }
          ]
        },
        {
          "req_id": "b",
          "path": "6.b",
          "text": "Make working drawings of a project needing curved or incised cuttings and build it.",
          "resources": [
            {
              "title": "Making Arcs & Curves the Easy Way (video)",
              "url": "https://youtu.be/867ho1Pp12U?si=T3zGA7JYZkWODfDv"
            }
          ]
        },
        {
          "req_id": "c",
          "path": "6.c",
          "text": "Make working drawings of a project needing miter, dowel, or mortise and tenon joints and build it.",
          "resources": [
            {
              "title": "Mitered Mortise & Tenon Joint (video)",
              "url": "https://youtu.be/h0ryuL0DuLE?si=aq-2Jk5UxvEdtZ4F"
            }
          ]
        },
        {
          "req_id": "d",
          "path": "6.d",
          "text": "Make a cabinet, box, or something else with a door or lid fastened with inset hinges.",
          "resources": [
            {
              "title": "The Special Wooden Box / Invisible Wooden Hinge - Using Basic Tools / Dovetail Joints (video)",
              "url": "https://youtu.be/Syv3JzRXld8?si=LG_MXwk4-tBuDBgK"
            },
            {
              "title": "An Absurd Number of Wood Box Making Tips & Tricks (video)",
              "url": "https://youtu.be/TazBJ5MSMgc?si=ulffNFnBiQ-I22fi"
            }
          ]
        },
        {
          "req_id": "e",
          "path": "6.e",
          "text": "Help make wooden toys for underprivileged children; OR help carry out a woodworking service project approved by your counselor for a charitable organization.",
          "resources": [
            {
              "title": "How to Make Wooden Toys for Kids | DIY | Great Home Ideas (video)",
              "url": "https://youtu.be/IwLwNGAxSfg?si=upaHucGcY9scLFYB"
            }
          ]
        }
      ],
      "subrequirement_mode": {
        "type": "select",
        "count": 2
      }
    },
    {
      "req_id": "7",
      "path": "7",
      "text": "Talk with a cabinetmaker or finish carpenter. Learn about training, apprenticeships, career opportunities, work conditions, work hours, pay rates, and union organization that woodworking experts have in your area.",
      "resources": [
        {
          "title": "A Day @ AWC : Careers in the Wood Industry (video)",
          "url": "https://youtu.be/lPTR2xdIz9M?si=pyFe8tLbhOh0zqT3"
        },
        {
          "title": "Kayleen McCabe - Her Career in Woodworking (video)",
          "url": "https://youtu.be/NBHhOMEs9Sk?si=JNOrbPzgNwLd6TK9"
        },
        {
          "title": "A Total Beginner's Guide to Woodworking (video)",
          "url": "https://youtu.be/zCNgrOR8FEU?si=U9HEuwvA3fi3iqOn"
        }
      ]
    }
  ]
}
