{
  "$schema": "../../static/schemas/merit-badge.schema.json",
  "title": "Artificial Intelligence",
  "slug": "artificial-intelligence",
  "url": "https://www.scouting.org/merit-badges/artificial-intelligence/",
  "eagle_required": false,
  "last_updated": "2025-12-24",
  "requirements": [
    {
      "req_id": "1",
      "path": "1",
      "text": "Key Concepts. Define the following terms and share the meaning of each with your counselor: artificial intelligence (AI), artificial intelligence agents, automation, basic programming, bots, data, databases, digital workers, general AI, machine learning (ML), narrow AI, superintelligent AI, tasks, triggers, workflows, and variables."
    },
    {
      "req_id": "2",
      "path": "2",
      "text": "Artificial Intelligence (AI) Basics. Do the following and share what you learned with your counselor:",
      "subrequirements": [
        {
          "req_id": "a",
          "path": "2.a",
          "text": "Identify 10 examples of how AI is currently used in everyday life."
        },
        {
          "req_id": "b",
          "path": "2.b",
          "text": "Identify 5 examples of how AI is currently used in the workplace."
        },
        {
          "req_id": "c",
          "path": "2.c",
          "text": "Identify 5 examples of how AI can be used at school or in support of your education."
        },
        {
          "req_id": "d",
          "path": "2.d",
          "text": "Meet with your counselor and play 10 rounds of the \"AI or Not?\" game to determine if the presented scenario utilizes AI. Discuss your answers."
        },
        {
          "req_id": "e",
          "path": "2.e",
          "text": "Create a timeline with five key milestones in the development of artificial intelligence."
        }
      ],
      "subrequirement_mode": {
        "type": "all"
      }
    },
    {
      "req_id": "3",
      "path": "3",
      "text": "Automation Basics. Do the following and share what you learned with your counselor:",
      "subrequirements": [
        {
          "req_id": "a",
          "path": "3.a",
          "text": "Identify 10 examples of how automation is currently used in everyday life."
        },
        {
          "req_id": "b",
          "path": "3.b",
          "text": "Identify 5 examples of how automation is currently used in the workplace."
        },
        {
          "req_id": "c",
          "path": "3.c",
          "text": "Identify 5 examples of how automation can be used at school or in support of your education."
        },
        {
          "req_id": "d",
          "path": "3.d",
          "text": "Explain how automation performs repetitive tasks without human intervention and how it reduces human error and optimizes resources."
        },
        {
          "req_id": "e",
          "path": "3.e",
          "text": "Create a timeline with five significant milestones in automation development."
        }
      ],
      "subrequirement_mode": {
        "type": "all"
      }
    },
    {
      "req_id": "4",
      "path": "4",
      "text": "Ethics in AI. Do the following and share what you learned with your counselor:",
      "subrequirements": [
        {
          "req_id": "a",
          "path": "4.a",
          "text": "Research ethical concerns and responsible use in AI, including bias, privacy, and AI decision-making."
        },
        {
          "req_id": "b",
          "path": "4.b",
          "text": "Meet with your counselor, play, and discuss 5 rounds of the \"What Would You Do?\" ethical decision-making scenarios."
        },
        {
          "req_id": "c",
          "path": "4.c",
          "text": "Develop your own ethical guidelines for the use of AI."
        },
        {
          "req_id": "d",
          "path": "4.d",
          "text": "What is the Turing test?"
        }
      ],
      "subrequirement_mode": {
        "type": "all"
      }
    },
    {
      "req_id": "5",
      "path": "5",
      "text": "Deepfakes. Do the following and share what you learned with your counselor:",
      "subrequirements": [
        {
          "req_id": "a",
          "path": "5.a",
          "text": "Explain what a deepfake is and how it can affect an individual."
        },
        {
          "req_id": "b",
          "path": "5.b",
          "text": "Describe what actions to take if you or someone you know is impacted by a deepfake."
        }
      ],
      "subrequirement_mode": {
        "type": "all"
      }
    },
    {
      "req_id": "6",
      "path": "6",
      "text": "Developing AI Skills. Do the following and share what you learned with your counselor:",
      "subrequirements": [
        {
          "req_id": "a",
          "path": "6.a",
          "text": "Discuss the learning process for AI and its limitations."
        },
        {
          "req_id": "b",
          "path": "6.b",
          "text": "Identify 5 methods of how to effectively communicate with AI."
        },
        {
          "req_id": "c",
          "path": "6.c",
          "text": "Explain the importance of prompt engineering when using AI to create better output."
        },
        {
          "req_id": "d",
          "path": "6.d",
          "text": "Demonstrate 3 examples of writing clear instructions for a school-related task."
        }
      ],
      "subrequirement_mode": {
        "type": "all"
      }
    },
    {
      "req_id": "7",
      "path": "7",
      "text": "Practical Application. Do ONE of the following:",
      "subrequirements": [
        {
          "req_id": "a",
          "path": "7.a",
          "text": "With your counselor's approval, choose an artificial intelligence project based on your personal interest or a community need. Develop a plan outlining the project's objectives, data requirements, and potential ethical considerations. Implement the project utilizing appropriate artificial intelligence tools, languages, or platforms. Share your project with your counselor. Discuss the steps you followed to create the project and your experience during the process."
        },
        {
          "req_id": "b",
          "path": "7.b",
          "text": "With your counselor's approval, design a short lesson plan on AI and teach it to your patrol of a group of Scouts. The lesson should include an AI-generated age-appropriate explanation of AI, examples of how AI is used in both everyday life as well as in the workplace, and an interactive demonstration of how Scouts could utilize AI to assist them with a school assignment, Scouting activity, or rank advancement. Share information on the development process and teaching experience with your counselor."
        }
      ],
      "subrequirement_mode": {
        "type": "select",
        "count": 1
      }
    },
    {
      "req_id": "8",
      "path": "8",
      "text": "Career Exploration. Do ONE of the following:",
      "subrequirements": [
        {
          "req_id": "a",
          "path": "8.a",
          "text": "Identify three career opportunities that would use skills and knowledge in artificial intelligence or automation. Pick one and research the training, education, certification requirements, experience, and expenses associated with entering the field. Research the prospects for employment, starting salary, advancement opportunities, and career goals associated with this career. Discuss what you learned with your counselor and whether you might be interested in this career."
        },
        {
          "req_id": "b",
          "path": "8.b",
          "text": "Interview an artificial intelligence or automation professional. Learn about their day-to-day work, the challenges they face, and their vision for the future of artificial intelligence or automation. Inquire about training, education, certification requirements, experience, and expenses associated with entering the field. Share what you learned with your counselor."
        }
      ],
      "subrequirement_mode": {
        "type": "select",
        "count": 1
      }
    }
  ]
}
