{
  "$schema": "../../static/schemas/merit-badge.schema.json",
  "title": "Architecture",
  "slug": "architecture",
  "url": "https://www.scouting.org/merit-badges/architecture/",
  "eagle_required": false,
  "pamphlet_url": "https://filestore.scouting.org/filestore/Merit_Badge_ReqandRes/Pamphlets/Architecture_Landscape.pdf",
  "last_updated": "2025-12-24",
  "requirements": [
    {
      "req_id": "1",
      "path": "1",
      "text": "Do the following:",
      "subrequirements": [
        {
          "req_id": "a",
          "path": "1.a",
          "text": "Tour your community and list the types of buildings you see. Try to identify buildings that can be associated with a specific period of history or style of architecture. Make a sketch of the building you most admire."
        },
        {
          "req_id": "b",
          "path": "1.b",
          "text": "Select a historical architectural achievement that has had a major impact on society. Using resources such as the internet (with your parent or guardian's permission), books, and magazines, find out how this achievement has influenced the world today. Tell your counselor what you learned."
        }
      ],
      "subrequirement_mode": {
        "type": "all"
      }
    },
    {
      "req_id": "2",
      "path": "2",
      "text": "In following the Leave No Trace Seven Principles and the Outdoor Code, Scouts pledge to \"Travel and camp on durable surfaces\" and to \"Leave what you find\" and to \"Be conservation-minded.\" Discuss the following with your counselor:",
      "subrequirements": [
        {
          "req_id": "a",
          "path": "2.a",
          "text": "The term sustainable architecture. Identify three features typical of green buildings."
        },
        {
          "req_id": "b",
          "path": "2.b",
          "text": "The difference between renewable building materials and recycled building materials, and how each can be used in construction."
        },
        {
          "req_id": "c",
          "path": "2.c",
          "text": "The relationship of architecture with its surrounding environment and the community."
        },
        {
          "req_id": "d",
          "path": "2.d",
          "text": "How entire buildings can be reused rather than torn down when they no longer serve their original purpose."
        }
      ],
      "subrequirement_mode": {
        "type": "all"
      }
    },
    {
      "req_id": "3",
      "path": "3",
      "text": "Do ONE of the following:",
      "subrequirements": [
        {
          "req_id": "a",
          "path": "3.a",
          "text": "With your parent or guardian's and counselor's permission and approval, arrange to meet with an architect. Ask to see the scale model of a building and the drawings that a builder would use to construct this building. Discuss why the different building materials were selected. Look at the details in the drawings and the model to see how the materials and components are attached to each other during construction."
        },
        {
          "req_id": "b",
          "path": "3.b",
          "text": "With your parent or guardian's and counselor's permission and approval, arrange to meet with an architect at a construction site. Ask the architect to bring drawings that the builder uses to construct the building. While at the site, discuss why the different building materials being used were selected. Discuss how the different building materials and components are attached to each other during construction. Note: To visit a construction site will require advance planning. You will need permission from your parents, counselor, the architect, and the construction site manager. A construction site is a very dangerous place. While there, you will need to closely follow the site manager's directions and comply with all the safety procedures, including wearing a hard hat, protective eyewear, and proper footwear. Be aware of the changing conditions at the site, and stay with the architect or site manager."
        },
        {
          "req_id": "c",
          "path": "3.c",
          "text": "Interview someone who might be your client (such as a prospective homeowner or business owner) if you were an architect. Find out what your client's requirements would be for designing a new home or business building. Write a short program including a list of requirements for the project, the functions of the building and site, how the functions relate to one another, and the goals of the project."
        }
      ],
      "subrequirement_mode": {
        "type": "select",
        "count": 1
      }
    },
    {
      "req_id": "4",
      "path": "4",
      "text": "Measure a room such as one where you live or where your troop meets. Make an accurately scaled drawing of the room's floor plan showing walls, doors, closets, windows, and any built-in furniture or cabinets. Neatly label your drawing with the following: your name, the date, what room you drew, and the scale of the drawing. (Drawing scale: 1/4 inch = 1 foot)"
    },
    {
      "req_id": "5",
      "path": "5",
      "text": "Find out about three career opportunities in architecture. Pick one and find out the education, training, and experience required for this profession. Discuss this with your counselor, and explain why this profession might interest you."
    }
  ]
}
