{
  "$schema": "../../static/schemas/merit-badge.schema.json",
  "title": "Dentistry",
  "slug": "dentistry",
  "url": "https://www.scouting.org/merit-badges/dentistry/",
  "eagle_required": false,
  "pamphlet_url": "https://filestore.scouting.org/filestore/Merit_Badge_ReqandRes/Pamphlets/Dentistry.pdf",
  "last_updated": "2025-12-24",
  "requirements": [
    {
      "req_id": "1",
      "path": "1",
      "text": "Using X-ray (radiographic) films or images and with your counselor's guidance, do the following:",
      "subrequirements": [
        {
          "req_id": "a",
          "path": "1.a",
          "text": "Study the tooth structure and look for decay."
        },
        {
          "req_id": "b",
          "path": "1.b",
          "text": "Draw a lower molar, using the radiographs as a guide. Label its parts and surfaces. Show surrounding structures such as bone and gum tissues."
        },
        {
          "req_id": "c",
          "path": "1.c",
          "text": "Show on your drawing where the nerves and blood vessels enter and leave the tooth."
        },
        {
          "req_id": "d",
          "path": "1.d",
          "text": "Show on your drawing where bacterial plaque is most likely to be found."
        }
      ],
      "subrequirement_mode": {
        "type": "all"
      }
    },
    {
      "req_id": "2",
      "path": "2",
      "text": "Do the following:",
      "subrequirements": [
        {
          "req_id": "a",
          "path": "2.a",
          "text": "Tell or write about what causes dental decay and gum disease.Tell how each of the following contributes to dental decay and gum disease: bacterial plaque, sugars, and acid."
        },
        {
          "req_id": "b",
          "path": "2.b",
          "text": "Tell the possible causes for traumatic tooth loss, describe the types of mouth guards used to help prevent tooth trauma, and list the athletic activities during which a person should wear a mouth guard."
        },
        {
          "req_id": "c",
          "path": "2.c",
          "text": "Explain the first-aid procedure for saving a tooth that has been knocked out."
        },
        {
          "req_id": "d",
          "path": "2.d",
          "text": "Discuss how the use of tobacco products can negatively affect your oral health."
        }
      ],
      "subrequirement_mode": {
        "type": "all"
      }
    },
    {
      "req_id": "3",
      "path": "3",
      "text": "Arrange for a visit with a dentist. Before you go, ask whether your visit can include a dental examination and a plaque-control demonstration. Afterward, ask questions about things you want to know. Then tell your counselor what the dentist does during a checkup examination."
    },
    {
      "req_id": "4",
      "path": "4",
      "text": "Do TWO of the following:",
      "subrequirements": [
        {
          "req_id": "a",
          "path": "4.a",
          "text": "Name at least five instruments and five pieces of equipment a dentist uses."
        },
        {
          "req_id": "b",
          "path": "4.b",
          "text": "With the help of a dentist, prepare a dental stone cast using a vibrator, a mixing bowl, a water measure, a plastic measure, model stone, and a spatula."
        },
        {
          "req_id": "c",
          "path": "4.c",
          "text": "Keep a record of everything you eat for three days. Circle those items that may provide the sugars that bacterial plaque needs to make acid. List snacks that you should avoid to help maintain the best oral health."
        }
      ],
      "subrequirement_mode": {
        "type": "select",
        "count": 2
      }
    },
    {
      "req_id": "5",
      "path": "5",
      "text": "Discuss with your counselor the following:",
      "subrequirements": [
        {
          "req_id": "a",
          "path": "5.a",
          "text": "How fluorides help prevent tooth decay and the ways fluorides can be provided to the teeth."
        },
        {
          "req_id": "b",
          "path": "5.b",
          "text": "How the mouth is related to the rest of the body. Topics might include chewing, saliva, enzymes, nutrition, and speech."
        }
      ],
      "subrequirement_mode": {
        "type": "all"
      }
    },
    {
      "req_id": "6",
      "path": "6",
      "text": "Do TWO of the following:",
      "subrequirements": [
        {
          "req_id": "a",
          "path": "6.a",
          "text": "Make a model tooth out of soap, clay, papier-m?ch?, or wax. Using a string and a large hand brush, show your troop or a school class proper tooth-brushing and flossing procedures."
        },
        {
          "req_id": "b",
          "path": "6.b",
          "text": "Make a poster on the prevention of dental disease. Show the importance of good oral health."
        },
        {
          "req_id": "c",
          "path": "6.c",
          "text": "Collect at least five advertisements for different toothpastes. List the claims that each one makes. Tell about the accuracy of the advertisements."
        },
        {
          "req_id": "d",
          "path": "6.d",
          "text": "Write a feature story for your school newspaper on the proper care of teeth and gums.Include in your story how the use of tobacco products can negatively affect a person's oral health."
        },
        {
          "req_id": "e",
          "path": "6.e",
          "text": "Make drawings and write about the progress of dental decay. Describe the types of dental filling and treatments a dentist can use to repair dental decay problems."
        }
      ],
      "subrequirement_mode": {
        "type": "select",
        "count": 2
      }
    },
    {
      "req_id": "7",
      "path": "7",
      "text": "Identify three career opportunities that would use skills and knowledge in dentistry. Pick one and research the training, education, certification requirements, experience, and expenses associated with entering the field. Research the prospects for employment, starting salary, advancement opportunities and career goals associated with this career. Discuss what you learned with your counselor and whether you might be interested in this career."
    }
  ]
}
