{
  "$schema": "../../static/schemas/merit-badge.schema.json",
  "title": "Health Care Professions",
  "slug": "health-care-professions",
  "url": "https://www.scouting.org/merit-badges/health-care-professions/",
  "eagle_required": false,
  "pamphlet_url": "https://filestore.scouting.org/filestore/Merit_Badge_ReqandRes/Pamphlets/Health%20Care%20Professions.pdf",
  "last_updated": "2025-12-26",
  "requirements": [
    {
      "req_id": "1",
      "path": "1",
      "text": "Select three of the professions from Group 1 listed below which interest you, then complete the following:",
      "subrequirements": [
        {
          "req_id": "a",
          "path": "1.a",
          "text": "Briefly describe to your counselor the roles these professionals play in the delivery of health care."
        },
        {
          "req_id": "b",
          "path": "1.b",
          "text": "Describe to your counselor the educational and licensing requirements for the professionals you selected."
        }
      ],
      "subrequirement_mode": {
        "type": "all"
      }
    },
    {
      "req_id": "2",
      "path": "2",
      "text": "Select three of the professions from Group 2 listed below which interest you, then complete the following:",
      "subrequirements": [
        {
          "req_id": "a",
          "path": "2.a",
          "text": "Briefly describe to your counselor the roles these professionals play in the delivery of health care."
        },
        {
          "req_id": "b",
          "path": "2.b",
          "text": "Describe to your counselor the educational and licensing requirements for the professionals you selected."
        }
      ],
      "subrequirement_mode": {
        "type": "all"
      }
    },
    {
      "req_id": "3",
      "path": "3",
      "text": "Select three of the professions from Group 3 listed below which interest you, then complete the following:",
      "subrequirements": [
        {
          "req_id": "a",
          "path": "3.a",
          "text": "Briefly describe to your counselor the roles these professionals play in the delivery of health care."
        },
        {
          "req_id": "b",
          "path": "3.b",
          "text": "Describe to your counselor the educational and licensing requirements for the professionals you selected."
        }
      ],
      "subrequirement_mode": {
        "type": "all"
      }
    },
    {
      "req_id": "4",
      "path": "4",
      "text": "Select three of the professions from Group 4 listed below which interest you, then complete the following:",
      "subrequirements": [
        {
          "req_id": "a",
          "path": "4.a",
          "text": "Briefly describe to your counselor the roles these professionals play in the delivery of health care."
        },
        {
          "req_id": "b",
          "path": "4.b",
          "text": "Describe to your counselor the educational and licensing requirements for the professionals you selected."
        }
      ],
      "subrequirement_mode": {
        "type": "all"
      }
    },
    {
      "req_id": "5",
      "path": "5",
      "text": "Select one career from any of the lists in Requirements 1, 2, 3, or 4 and arrange to visit that professional at theirworkplace. Discuss with your counselor the following:",
      "subrequirements": [
        {
          "req_id": "a",
          "path": "5.a",
          "text": "Why did they choose their particular career?"
        },
        {
          "req_id": "b",
          "path": "5.b",
          "text": "What do they most like about their job?"
        },
        {
          "req_id": "c",
          "path": "5.c",
          "text": "What are their biggest challenges in doing their job?"
        },
        {
          "req_id": "d",
          "path": "5.d",
          "text": "Identify the tools/instruments that may be used in their jobs."
        },
        {
          "req_id": "e",
          "path": "5.e",
          "text": "What has been the most surprising aspect of their career?"
        },
        {
          "req_id": "f",
          "path": "5.f",
          "text": "What continuing education requirements are required to maintain certification?"
        }
      ],
      "subrequirement_mode": {
        "type": "all"
      }
    },
    {
      "req_id": "6",
      "path": "6",
      "text": "Discuss with your counselor your understanding of the meaning of the Physician's Oath."
    },
    {
      "req_id": "7",
      "path": "7",
      "text": "Describe the role of confidentiality between a patient and the health care provider. What is HIPAA?"
    },
    {
      "req_id": "8",
      "path": "8",
      "text": "Identify a medical advancement or discovery that has been in the news recently. Discuss with your counselor how this can affect patient care."
    },
    {
      "req_id": "9",
      "path": "9",
      "text": "With your parent or guardian's and counselor's approval, serve as a volunteer at a health-related event or facility in your community (e.g. blood drive, health fair, blood pressure screening event). Report to your counselor what you did and learned from the experience."
    }
  ]
}
