{
  "$schema": "../../static/schemas/merit-badge.schema.json",
  "title": "Veterinary Medicine",
  "slug": "veterinary-medicine",
  "url": "https://www.scouting.org/merit-badges/veterinary-medicine/",
  "eagle_required": false,
  "pamphlet_url": "https://filestore.scouting.org/filestore/Merit_Badge_ReqandRes/Pamphlets/Veterinary%20Medicine.pdf",
  "last_updated": "2026-01-10",
  "requirements": [
    {
      "req_id": "1",
      "path": "1",
      "text": "Discuss with your counselor the roles a veterinarian plays in the following:",
      "subrequirements": [
        {
          "req_id": "a",
          "path": "1.a",
          "text": "Companion or small animal medicine, and equine medicine"
        },
        {
          "req_id": "b",
          "path": "1.b",
          "text": "Food animal or large animal medicine"
        },
        {
          "req_id": "c",
          "path": "1.c",
          "text": "Exotic animal medicine"
        },
        {
          "req_id": "d",
          "path": "1.d",
          "text": "Marine animal medicine (mammal and fish)"
        },
        {
          "req_id": "e",
          "path": "1.e",
          "text": "Poultry medicine"
        },
        {
          "req_id": "f",
          "path": "1.f",
          "text": "Wildlife medicine and aquaculture medicine."
        }
      ],
      "subrequirement_mode": {
        "type": "all"
      }
    },
    {
      "req_id": "2",
      "path": "2",
      "text": "Discuss with your counselor the roles a veterinarian plays in the following:",
      "subrequirements": [
        {
          "req_id": "a",
          "path": "2.a",
          "text": "Public health medicine and zoonotic disease surveillance and control"
        },
        {
          "req_id": "b",
          "path": "2.b",
          "text": "The military"
        },
        {
          "req_id": "c",
          "path": "2.c",
          "text": "Food safety and inspection"
        },
        {
          "req_id": "d",
          "path": "2.d",
          "text": "Laboratory animal medicine and research"
        },
        {
          "req_id": "e",
          "path": "2.e",
          "text": "Teaching and government."
        }
      ],
      "subrequirement_mode": {
        "type": "all"
      }
    },
    {
      "req_id": "3",
      "path": "3",
      "text": "Describe the training required to become a veterinarian. Where is the veterinary medical college in your state or nearest to you? Describe the prerequisites for applying to veterinary school."
    },
    {
      "req_id": "4",
      "path": "4",
      "text": "Tell your counselor what a registered veterinary technician (R. T. V.) or animal health technician (A. H. T.) is. Describe the training required to become an R. V. T. or A. H. T. Where is the school or facility for R. V. T. or A. H. T training in your state or nearest to you? Describe the role an R. V. T. or A. H. T. would play in assisting a veterinarian working in three of the practice types listed in requirement 1."
    },
    {
      "req_id": "5",
      "path": "5",
      "text": "Discuss with your counselor the role a veterinarian plays in the human-animal bond."
    },
    {
      "req_id": "6",
      "path": "6",
      "text": "Do ONE of the following:",
      "subrequirements": [
        {
          "req_id": "a",
          "path": "6.a",
          "text": "Visit a veterinary clinic, hospital, or veterinary referral teaching hospital that does work in one of the practices listed in requirement 1. Spend as much time as you can observing the veterinarians and their staff. Prepare a presentation on what you observed and learned at the facility and share with your counselor."
        },
        {
          "req_id": "b",
          "path": "6.b",
          "text": "Spend as much time as possible with a veterinarian who works in one of the fields listed in requirement 2. Learn what special training beyond veterinary medical school may have been required for that position. Learn about any special or unusual activities required of this position. Prepare a presentation and share what you have learned about this field of veterinary medicine with your counselor. Include how this field serves the needs of the general public."
        }
      ],
      "subrequirement_mode": {
        "type": "select",
        "count": 1
      }
    },
    {
      "req_id": "7",
      "path": "7",
      "text": "Select one career from any of the lists in requirements 1 or 2. Discuss the following with your counselor:",
      "subrequirements": [
        {
          "req_id": "a",
          "path": "7.a",
          "text": "Why would one choose this particular career field?"
        },
        {
          "req_id": "b",
          "path": "7.b",
          "text": "What would you like about this job?"
        },
        {
          "req_id": "c",
          "path": "7.c",
          "text": "What would be the biggest challenges in doing this job?"
        },
        {
          "req_id": "d",
          "path": "7.d",
          "text": "What to you has been the most surprising aspect of this job?"
        },
        {
          "req_id": "e",
          "path": "7.e",
          "text": "What continuing education requirements are required to maintain certification for this job?"
        }
      ],
      "subrequirement_mode": {
        "type": "all"
      }
    }
  ]
}
