{
  "$schema": "../../static/schemas/merit-badge.schema.json",
  "title": "Salesmanship",
  "slug": "salesmanship",
  "url": "https://www.scouting.org/merit-badges/salesmanship/",
  "eagle_required": false,
  "pamphlet_url": "https://filestore.scouting.org/filestore/Merit_Badge_ReqandRes/Pamphlets/Salesmanship.pdf",
  "last_updated": "2025-12-26",
  "requirements": [
    {
      "req_id": "1",
      "path": "1",
      "text": "Do the following:",
      "subrequirements": [
        {
          "req_id": "a",
          "path": "1.a",
          "text": "Explain the responsibilities of a salesperson and how a salesperson serves customers and helps stimulate the economy."
        },
        {
          "req_id": "b",
          "path": "1.b",
          "text": "Explain the differences between a business-to-business salesperson and a consumer salesperson."
        }
      ],
      "subrequirement_mode": {
        "type": "all"
      }
    },
    {
      "req_id": "2",
      "path": "2",
      "text": "Explain why it is important for a salesperson to do the following:",
      "subrequirements": [
        {
          "req_id": "a",
          "path": "2.a",
          "text": "Research the market to be sure the product or service meets the needs of customers."
        },
        {
          "req_id": "b",
          "path": "2.b",
          "text": "Learn all about the product to be sold."
        },
        {
          "req_id": "c",
          "path": "2.c",
          "text": "If possible, visit the location where the product is built and learn how it is constructed. If a service is being sold, learn about the benefits of the service to the customer."
        },
        {
          "req_id": "d",
          "path": "2.d",
          "text": "Follow up with customers after their purchase to confirm their satisfaction and discuss their concerns about the product."
        }
      ],
      "subrequirement_mode": {
        "type": "all"
      }
    },
    {
      "req_id": "3",
      "path": "3",
      "text": "Write and present a sales plan for a product and a sales territory assigned by your counselor."
    },
    {
      "req_id": "4",
      "path": "4",
      "text": "Make a sales presentation of a product assigned by your counselor."
    },
    {
      "req_id": "5",
      "path": "5",
      "text": "Do ONE of the following and keep a record (cost sheet). Use the sales techniques you have learned, and share your experience with your counselor:",
      "subrequirements": [
        {
          "req_id": "a",
          "path": "5.a",
          "text": "Help your unit raise funds through sales of merchandise or of tickets to a Scout event."
        },
        {
          "req_id": "b",
          "path": "5.b",
          "text": "Sell your services such as lawn raking or mowing, pet watching, dog walking, show shoveling, and car washing to your neighbors. Follow up after the service has been completed and determine the customer's satisfaction."
        },
        {
          "req_id": "c",
          "path": "5.c",
          "text": "Earn money through retail selling."
        }
      ],
      "subrequirement_mode": {
        "type": "select",
        "count": 1
      }
    },
    {
      "req_id": "6",
      "path": "6",
      "text": "Do ONE of the following:",
      "subrequirements": [
        {
          "req_id": "a",
          "path": "6.a",
          "text": "Interview a salesperson and learn the following:",
          "subrequirements": [
            {
              "req_id": "1",
              "path": "6.a.1",
              "text": "What made the person choose sales as a profession?"
            },
            {
              "req_id": "2",
              "path": "6.a.2",
              "text": "What are the most important things to remember when talking to customers?"
            },
            {
              "req_id": "3",
              "path": "6.a.3",
              "text": "How is the product sold?"
            },
            {
              "req_id": "4",
              "path": "6.a.4",
              "text": "Include your own questions."
            }
          ],
          "subrequirement_mode": {
            "type": "all"
          }
        },
        {
          "req_id": "b",
          "path": "6.b",
          "text": "Interview a retail store owner and learn the following:",
          "subrequirements": [
            {
              "req_id": "1",
              "path": "6.b.1",
              "text": "How often is the owner approached by a sales representative?"
            },
            {
              "req_id": "2",
              "path": "6.b.2",
              "text": "What good traits should a sales representative have? What habits should the sales representative avoid?"
            },
            {
              "req_id": "3",
              "path": "6.b.3",
              "text": "What does the owner consider when deciding whether to establish an account with a sales representative?"
            },
            {
              "req_id": "4",
              "path": "6.b.4",
              "text": "Include at least two of your own questions."
            }
          ],
          "subrequirement_mode": {
            "type": "all"
          }
        }
      ],
      "subrequirement_mode": {
        "type": "select",
        "count": 1
      }
    },
    {
      "req_id": "7",
      "path": "7",
      "text": "Investigate and report on career opportunities in sales, then do the following:",
      "subrequirements": [
        {
          "req_id": "a",
          "path": "7.a",
          "text": "Prepare a written statement of your qualifications and experience. Include relevant classes you have taken in school and merit badges you have earned."
        },
        {
          "req_id": "b",
          "path": "7.b",
          "text": "Discuss with your counselor what education, experience, or training you should obtain so you are prepared to serve in a sales position."
        }
      ],
      "subrequirement_mode": {
        "type": "all"
      }
    }
  ]
}
